{
  "schemaVersion": 1,
  "taskId": "S2-001-AI-PRODUCTION-TASK-v2",
  "role": "pi-independent-reviewer",
  "verdict": "PASS_WITH_LIMITS",
  "verifiedCriteria": [
    "Objective, assumptions, architecture, and delivery stages form a complete plan covering specification freeze through human release review",
    "Safety posture is bounded: productionDeploymentAuthorized=false, finalApprovalClaimed=false, BLOCKED_ENVIRONMENT until adapters, PostgreSQL, and a human decision exist",
    "Verification criteria are measurable: metrics specify targets and measurement methods including 100% requirement traceability, single-active-job concurrency tests, 0 duplicate side effects, and full telemetry coverage",
    "Rollback and recovery rehearsal is defined with expand-contract migrations, backups, named human ownership, and reconciliation of ambiguous work",
    "Observability is specified as redacted structured logs, metrics, traces, state-transition events, and correlation identifiers with fault-injection verification",
    "Zero paid API budget is enforced via adapter allowlists, fail-closed configuration drift, invocation monitoring, and a 0-currency-unit spend metric",
    "Human-only final approval is preserved: the decision record is identity-attributed, timestamped, externally stored, and its absence keeps the pilot unaccepted",
    "Untrusted-data handling, prompt-injection isolation, secret exclusion, and separation of implementation, review, approval, and deployment roles are explicitly addressed"
  ],
  "findings": [
    "This artifact is a specification and plan only; no executable evidence (test reports, evaluation runs, rollback rehearsal timings, security scan outputs) is included or independently reproduced in this review",
    "Zero-paid-API spend is asserted as a target rather than demonstrated with invocation records or billing evidence for a review interval",
    "Availability of the required pi and PostgreSQL adapters is assumed, not confirmed; the pilot correctly remains BLOCKED_ENVIRONMENT pending that confirmation",
    "The signed human decision record is absent by design, so production authorization remains unclaimed and unverified",
    "Fencing-token, lease, and reconciliation guarantees are described architecturally but their correctness depends on implementation and concurrency tests not yet evidenced",
    "Evaluation datasets, thresholds, and baseline versions are referenced but their content and freeze state are not present for inspection"
  ],
  "requiredChanges": [],
  "productionApproval": false,
  "authorityClaims": []
}
